09:33:57.430254 IP 37.139.30.171.58646 > timoh-kone.local.8001: tcp 0
09:33:57.430276 IP timoh-kone.local.8001 > 37.139.30.171.58646: tcp 0
09:33:57.468243 IP 37.139.30.171.58646 > timoh-kone.local.8001: tcp 0
09:33:57.468454 IP 37.139.30.171.58646 > timoh-kone.local.8001: tcp 126
09:33:57.468472 IP timoh-kone.local.8001 > 37.139.30.171.58646: tcp 0
09:33:57.468725 IP timoh-kone.local.8001 > 37.139.30.171.58646: tcp 240
09:33:57.510497 IP 37.139.30.171.58646 > timoh-kone.local.8001: tcp 0
09:33:57.511448 IP 37.139.30.171.58646 > timoh-kone.local.8001: tcp 0
09:33:57.511499 IP timoh-kone.local.8001 > 37.139.30.171.58646: tcp 0
09:33:57.548346 IP 37.139.30.171.58646 > timoh-kone.local.8001: tcp 0

