09:31:07.391573 IP timoh-kone.local.60964 > 62.78.217.30.8001: tcp 0
09:31:07.391885 IP 62.78.217.30.60964 > timoh-kone.local.8001: tcp 0
09:31:07.391899 IP timoh-kone.local.8001 > 62.78.217.30.60964: tcp 0
09:31:07.392013 IP 62.78.217.30.8001 > timoh-kone.local.60964: tcp 0
09:31:07.392023 IP timoh-kone.local.60964 > 62.78.217.30.8001: tcp 0
09:31:07.392190 IP 62.78.217.30.60964 > timoh-kone.local.8001: tcp 0
09:31:07.392227 IP timoh-kone.local.60964 > 62.78.217.30.8001: tcp 336
09:31:07.392476 IP 62.78.217.30.60964 > timoh-kone.local.8001: tcp 336
09:31:07.392482 IP timoh-kone.local.8001 > 62.78.217.30.60964: tcp 0
09:31:07.392584 IP 62.78.217.30.8001 > timoh-kone.local.60964: tcp 0
09:31:07.393422 IP timoh-kone.local.8001 > 62.78.217.30.60964: tcp 14
09:31:07.393521 IP timoh-kone.local.8001 > 62.78.217.30.60964: tcp 444
09:31:07.393532 IP 62.78.217.30.8001 > timoh-kone.local.60964: tcp 14
09:31:07.393537 IP timoh-kone.local.60964 > 62.78.217.30.8001: tcp 0
09:31:07.393725 IP 62.78.217.30.8001 > timoh-kone.local.60964: tcp 444
09:31:07.393735 IP 62.78.217.30.60964 > timoh-kone.local.8001: tcp 0
09:31:07.393879 IP timoh-kone.local.60964 > 62.78.217.30.8001: tcp 0
09:31:07.393982 IP 62.78.217.30.60964 > timoh-kone.local.8001: tcp 0
09:31:07.394000 IP timoh-kone.local.8001 > 62.78.217.30.60964: tcp 0
09:31:07.394110 IP 62.78.217.30.8001 > timoh-kone.local.60964: tcp 0

