19:37:37.545498 IP 37.139.30.171.45506 > timoh-kone.local.8001: tcp 0
19:37:37.545520 IP timoh-kone.local.8001 > 37.139.30.171.45506: tcp 0
19:37:37.583207 IP 37.139.30.171.45506 > timoh-kone.local.8001: tcp 0
19:37:37.583493 IP 37.139.30.171.45506 > timoh-kone.local.8001: tcp 304
19:37:37.583511 IP timoh-kone.local.8001 > 37.139.30.171.45506: tcp 0
19:37:37.584664 IP timoh-kone.local.8001 > 37.139.30.171.45506: tcp 14
19:37:37.584785 IP timoh-kone.local.8001 > 37.139.30.171.45506: tcp 444
19:37:37.585866 IP timoh-kone.local.8001 > 37.139.30.171.45506: tcp 0
19:37:37.625393 IP 37.139.30.171.45506 > timoh-kone.local.8001: tcp 0
19:37:37.625407 IP 37.139.30.171.45506 > timoh-kone.local.8001: tcp 0

